{
  "$schema": "../schema/measurement-contract.schema.json",
  "schemaVersion": 1,
  "releaseId": "ekf-2-measurement-semantics-v1",
  "description": "Explicit exercise-defined measurement contracts for the 119-entry Big Gains compatibility catalog.",
  "contracts": [
    {
      "exerciseId": "a91d27f9-e4e9-4498-ad48-f0e7db8e8a85",
      "legacyId": "seated-machine-chest-press",
      "contentRevision": 2,
      "laterality": "bilateral",
      "measurement": {
        "trackingModel": "load_reps",
        "loadSemantics": {
          "loadBasis": "total",
          "resistanceSemantics": "machine_indicated"
        },
        "repSemantics": "bilateral_cycle",
        "bodyweightModel": null,
        "ui": {
          "loadLabel": "Machine weight",
          "loadUnit": "lb",
          "loadStep": 5,
          "repsLabel": "Reps"
        }
      },
      "analytics": {
        "e1rmPermitted": false,
        "e1rmLoadBasis": null
      },
      "muscles": {
        "primary": [
          "Chest"
        ],
        "secondary": [],
        "stabilizer": []
      }
    },
    {
      "exerciseId": "d4f7cf94-db5d-43b9-9944-dca188011e72",
      "legacyId": "seated-iso-lateral-bench-press",
      "contentRevision": 2,
      "laterality": "independent_bilateral",
      "measurement": {
        "trackingModel": "load_reps",
        "loadSemantics": {
          "loadBasis": "per_side",
          "resistanceSemantics": "machine_indicated"
        },
        "repSemantics": "bilateral_cycle",
        "bodyweightModel": null,
        "ui": {
          "loadLabel": "Weight per side",
          "loadUnit": "lb",
          "loadStep": 5,
          "repsLabel": "Reps"
        }
      },
      "analytics": {
        "e1rmPermitted": false,
        "e1rmLoadBasis": null
      },
      "muscles": {
        "primary": [
          "Chest"
        ],
        "secondary": [],
        "stabilizer": []
      }
    },
    {
      "exerciseId": "e716514a-8bb7-4836-bc5c-673d257169da",
      "legacyId": "incline-iso-machine-press",
      "contentRevision": 2,
      "laterality": "independent_bilateral",
      "measurement": {
        "trackingModel": "load_reps",
        "loadSemantics": {
          "loadBasis": "per_side",
          "resistanceSemantics": "machine_indicated"
        },
        "repSemantics": "bilateral_cycle",
        "bodyweightModel": null,
        "ui": {
          "loadLabel": "Weight per side",
          "loadUnit": "lb",
          "loadStep": 5,
          "repsLabel": "Reps"
        }
      },
      "analytics": {
        "e1rmPermitted": false,
        "e1rmLoadBasis": null
      },
      "muscles": {
        "primary": [
          "Chest"
        ],
        "secondary": [],
        "stabilizer": []
      }
    },
    {
      "exerciseId": "46d1003f-98b0-43aa-a13f-7861c326cc66",
      "legacyId": "smith-machine-incline-press",
      "contentRevision": 2,
      "laterality": "bilateral",
      "measurement": {
        "trackingModel": "load_reps",
        "loadSemantics": {
          "loadBasis": "total",
          "resistanceSemantics": "machine_indicated"
        },
        "repSemantics": "bilateral_cycle",
        "bodyweightModel": null,
        "ui": {
          "loadLabel": "Total weight",
          "loadUnit": "lb",
          "loadStep": 5,
          "repsLabel": "Reps"
        }
      },
      "analytics": {
        "e1rmPermitted": false,
        "e1rmLoadBasis": null
      },
      "muscles": {
        "primary": [
          "Chest"
        ],
        "secondary": [],
        "stabilizer": []
      }
    },
    {
      "exerciseId": "e6815fb8-ab2c-41ee-b8dc-1141af5fee8b",
      "legacyId": "flat-smith-machine-bench-press",
      "contentRevision": 2,
      "laterality": "bilateral",
      "measurement": {
        "trackingModel": "load_reps",
        "loadSemantics": {
          "loadBasis": "total",
          "resistanceSemantics": "machine_indicated"
        },
        "repSemantics": "bilateral_cycle",
        "bodyweightModel": null,
        "ui": {
          "loadLabel": "Total weight",
          "loadUnit": "lb",
          "loadStep": 5,
          "repsLabel": "Reps"
        }
      },
      "analytics": {
        "e1rmPermitted": false,
        "e1rmLoadBasis": null
      },
      "muscles": {
        "primary": [
          "Chest"
        ],
        "secondary": [],
        "stabilizer": []
      }
    },
    {
      "exerciseId": "fe9b24dd-e6db-41d3-9395-596830a0a37a",
      "legacyId": "barbell-bench-press",
      "contentRevision": 2,
      "laterality": "bilateral",
      "measurement": {
        "trackingModel": "load_reps",
        "loadSemantics": {
          "loadBasis": "total",
          "resistanceSemantics": "external"
        },
        "repSemantics": "bilateral_cycle",
        "bodyweightModel": null,
        "ui": {
          "loadLabel": "Total weight",
          "loadUnit": "lb",
          "loadStep": 5,
          "repsLabel": "Reps"
        }
      },
      "analytics": {
        "e1rmPermitted": true,
        "e1rmLoadBasis": "combined_external_load"
      },
      "muscles": {
        "primary": [
          "Chest"
        ],
        "secondary": [],
        "stabilizer": []
      }
    },
    {
      "exerciseId": "c88a0b76-3cc6-405b-afe9-b4ce5f45e0b5",
      "legacyId": "decline-barbell-bench-press",
      "contentRevision": 2,
      "laterality": "bilateral",
      "measurement": {
        "trackingModel": "load_reps",
        "loadSemantics": {
          "loadBasis": "total",
          "resistanceSemantics": "external"
        },
        "repSemantics": "bilateral_cycle",
        "bodyweightModel": null,
        "ui": {
          "loadLabel": "Total weight",
          "loadUnit": "lb",
          "loadStep": 5,
          "repsLabel": "Reps"
        }
      },
      "analytics": {
        "e1rmPermitted": true,
        "e1rmLoadBasis": "combined_external_load"
      },
      "muscles": {
        "primary": [
          "Chest"
        ],
        "secondary": [],
        "stabilizer": []
      }
    },
    {
      "exerciseId": "64a28c27-909f-4f0a-adfa-7a294dcea60c",
      "legacyId": "dumbbell-bench-press",
      "contentRevision": 2,
      "laterality": "independent_bilateral",
      "measurement": {
        "trackingModel": "load_reps",
        "loadSemantics": {
          "loadBasis": "per_hand",
          "resistanceSemantics": "external"
        },
        "repSemantics": "bilateral_cycle",
        "bodyweightModel": null,
        "ui": {
          "loadLabel": "Weight per dumbbell",
          "loadUnit": "lb",
          "loadStep": 5,
          "repsLabel": "Reps"
        }
      },
      "analytics": {
        "e1rmPermitted": true,
        "e1rmLoadBasis": "entered_load"
      },
      "muscles": {
        "primary": [
          "Chest"
        ],
        "secondary": [],
        "stabilizer": []
      }
    },
    {
      "exerciseId": "3ee9949f-fabe-4387-8bb9-d14f775e02cf",
      "legacyId": "incline-dumbbell-press",
      "contentRevision": 2,
      "laterality": "independent_bilateral",
      "measurement": {
        "trackingModel": "load_reps",
        "loadSemantics": {
          "loadBasis": "per_hand",
          "resistanceSemantics": "external"
        },
        "repSemantics": "bilateral_cycle",
        "bodyweightModel": null,
        "ui": {
          "loadLabel": "Weight per dumbbell",
          "loadUnit": "lb",
          "loadStep": 5,
          "repsLabel": "Reps"
        }
      },
      "analytics": {
        "e1rmPermitted": true,
        "e1rmLoadBasis": "entered_load"
      },
      "muscles": {
        "primary": [
          "Chest"
        ],
        "secondary": [],
        "stabilizer": []
      }
    },
    {
      "exerciseId": "dce44595-28a0-4250-ada3-4b8fa7fee916",
      "legacyId": "decline-dumbbell-press",
      "contentRevision": 2,
      "laterality": "independent_bilateral",
      "measurement": {
        "trackingModel": "load_reps",
        "loadSemantics": {
          "loadBasis": "per_hand",
          "resistanceSemantics": "external"
        },
        "repSemantics": "bilateral_cycle",
        "bodyweightModel": null,
        "ui": {
          "loadLabel": "Weight per dumbbell",
          "loadUnit": "lb",
          "loadStep": 5,
          "repsLabel": "Reps"
        }
      },
      "analytics": {
        "e1rmPermitted": true,
        "e1rmLoadBasis": "entered_load"
      },
      "muscles": {
        "primary": [
          "Chest"
        ],
        "secondary": [],
        "stabilizer": []
      }
    },
    {
      "exerciseId": "d175ba6c-0604-4c3f-99cc-fe6ce885a236",
      "legacyId": "cable-chest-fly",
      "contentRevision": 2,
      "laterality": "independent_bilateral",
      "measurement": {
        "trackingModel": "load_reps",
        "loadSemantics": {
          "loadBasis": "per_side",
          "resistanceSemantics": "machine_indicated"
        },
        "repSemantics": "bilateral_cycle",
        "bodyweightModel": null,
        "ui": {
          "loadLabel": "Stack weight per side",
          "loadUnit": "lb",
          "loadStep": 5,
          "repsLabel": "Reps"
        }
      },
      "analytics": {
        "e1rmPermitted": false,
        "e1rmLoadBasis": null
      },
      "muscles": {
        "primary": [
          "Chest"
        ],
        "secondary": [],
        "stabilizer": []
      }
    },
    {
      "exerciseId": "70f2c251-e665-4b86-b44e-75693b62102f",
      "legacyId": "incline-cable-fly",
      "contentRevision": 2,
      "laterality": "independent_bilateral",
      "measurement": {
        "trackingModel": "load_reps",
        "loadSemantics": {
          "loadBasis": "per_side",
          "resistanceSemantics": "machine_indicated"
        },
        "repSemantics": "bilateral_cycle",
        "bodyweightModel": null,
        "ui": {
          "loadLabel": "Stack weight per side",
          "loadUnit": "lb",
          "loadStep": 5,
          "repsLabel": "Reps"
        }
      },